{
  "schema_id": "climateos.mechanism_return_gate.v0.1",
  "gate": {"base_main_sha": "5bfc2312b8d93783de7e94af57d8a86351f71563", "task_range": "TASK1701_1710", "mode": "NO_RUN_REFERENCE_REVALIDATION", "assessed_on": "2026-07-17"},
  "references": [
    {"reference_id": "MECH-REF-001", "name": "TianJi-Environ preprint", "kind": "PAPER", "canonical_url": "https://arxiv.org/abs/2606.07697", "identity": "arXiv:2606.07697 v1 2026-06-05", "licence_state": "PAPER_REFERENCE_ONLY", "artifact_state": "PREPRINT", "runtime_state": "NOT_ADMITTED_NOT_EXECUTED", "climateos_use": "REFERENCE_ONLY"},
    {"reference_id": "MECH-REF-002", "name": "TianJi-Environ supporting repository", "kind": "SUPPORTING_REPOSITORY", "canonical_url": "https://github.com/zwww-www/TianJi-Environ", "identity": "main observed at ee26817955a1cdd7f7057225d90d3fac447438f1", "licence_state": "MIT_ARTIFACTS_THIRD_PARTY_SEPARATE", "artifact_state": "CURATED_ARTIFACTS_NOT_FULL_RUNTIME", "runtime_state": "NOT_ADMITTED_NOT_EXECUTED", "climateos_use": "REFERENCE_ONLY"},
    {"reference_id": "MECH-REF-003", "name": "WRF official repository release-v4.8.0 branch", "kind": "MODEL_REPOSITORY", "canonical_url": "https://github.com/wrf-model/WRF/tree/release-v4.8.0", "identity": "candidate lock release-v4.8.0 at 0708348f52037c6c8290c8ae2432525814240b2c", "licence_state": "PUBLIC_DOMAIN_NOTICE_TRADEMARK_RESERVED", "artifact_state": "RELEASE_BRANCH_CANDIDATE", "runtime_state": "NOT_ADMITTED_NOT_EXECUTED", "climateos_use": "REFERENCE_ONLY"},
    {"reference_id": "MECH-REF-004", "name": "AI Scientist v2", "kind": "ALTERNATIVE_AGENT_SYSTEM", "canonical_url": "https://github.com/SakanaAI/AI-Scientist-v2", "identity": "public autonomous research codebase observed 2026-07-17", "licence_state": "RESPONSIBLE_SOURCE_LICENCE_REVIEW_REQUIRED", "artifact_state": "PUBLIC_AUTONOMOUS_CODEBASE", "runtime_state": "NOT_ADMITTED_NOT_EXECUTED", "climateos_use": "REFERENCE_ONLY"},
    {"reference_id": "MECH-REF-005", "name": "TianJi atmospheric mechanism preprint", "kind": "PAPER", "canonical_url": "https://arxiv.org/abs/2603.27738", "identity": "arXiv:2603.27738 v1 2026-03-29", "licence_state": "PAPER_REFERENCE_ONLY", "artifact_state": "PREPRINT", "runtime_state": "NOT_ADMITTED_NOT_EXECUTED", "climateos_use": "REFERENCE_ONLY"}
  ],
  "model_components": [
    {"component_id": "MECH-COMP-001", "name": "WRF_CORE", "role": "meteorological numerical core", "version_identity": "release-v4.8.0 candidate branch at 0708348f52037c6c8290c8ae2432525814240b2c", "licence_state": "WRF public-domain notice; trademark reserved", "dependency_state": "submodules and build matrix not admitted", "admission_state": "REFERENCE_CANDIDATE_ONLY"},
    {"component_id": "MECH-COMP-002", "name": "WRF_CHEM", "role": "chemistry coupling and mechanisms", "version_identity": "must be bound separately to compatible WRF configuration", "licence_state": "component and third-party chemistry review required", "dependency_state": "chemistry mechanism and emissions tooling unresolved", "admission_state": "UNRESOLVED_BLOCKED"},
    {"component_id": "MECH-COMP-003", "name": "WPS", "role": "pre-processing", "version_identity": "not locked by this batch", "licence_state": "separate repository review required", "dependency_state": "geography and meteorological inputs unresolved", "admission_state": "UNRESOLVED_BLOCKED"},
    {"component_id": "MECH-COMP-004", "name": "PHYSICS_AND_CHEMISTRY_OPTIONS", "role": "scientific configuration", "version_identity": "no namelist or scheme admitted", "licence_state": "scheme-level review required", "dependency_state": "compatibility matrix unresolved", "admission_state": "UNRESOLVED_BLOCKED"},
    {"component_id": "MECH-COMP-005", "name": "INPUT_AND_BOUNDARY_ASSETS", "role": "meteorology emissions geography and observations", "version_identity": "none admitted", "licence_state": "dataset-level review required", "dependency_state": "all real assets blocked", "admission_state": "UNRESOLVED_BLOCKED"},
    {"component_id": "MECH-COMP-006", "name": "COMPUTE_ENVIRONMENT", "role": "build and execution environment", "version_identity": "none admitted", "licence_state": "toolchain review required", "dependency_state": "compiler libraries hardware cost and carbon budget unresolved", "admission_state": "UNRESOLVED_BLOCKED"}
  ],
  "hypothesis_contract": {"required_fields": ["research_question", "hypothesis", "mechanism_chain", "expected_direction", "required_diagnostics", "alternative_explanations", "falsification_criteria", "evidence_threshold", "scale_and_time_assumptions", "expert_owner"], "causal_claim_prohibited": true, "expert_owner_required": true, "not_testable_is_valid": true},
  "experiment_contract": {"required_fields": ["baseline", "perturbation", "control", "sensitivity", "model_version", "configuration_hash", "input_identity", "boundary_identity", "diagnostics", "stop_conditions", "compute_ceiling", "failure_log"], "immutable_registration_required": true, "run_permission": "NOT_AUTHORIZED", "allowed_outcomes": ["READY_FOR_TINY_SYNTHETIC_DESIGN_GATE", "REFERENCE_REVIEW_INCOMPLETE", "LICENCE_OR_VERSION_BLOCKED", "DATA_OR_COMPUTE_NOT_READY", "EXPERT_REVIEW_REQUIRED", "NOT_TESTABLE", "DO_NOT_PROCEED"]},
  "readiness": {"reference_identity": "PARTIAL_PASS", "version": "CANDIDATE_LOCK_REQUIRES_RELEASE_RECHECK", "licence": "COMPONENT_LEVEL_REVIEW_REQUIRED", "data": "NOT_ADMITTED", "compute": "NOT_ADMITTED", "expert": "UNASSIGNED", "reproducibility": "CURATED_ARTIFACTS_NOT_FULL_REPRODUCTION", "overall": "REFERENCE_REVIEW_INCOMPLETE"},
  "trials": [
    {"trial_id": "MECH-GATE-TRIAL-001", "request": "REGISTER_NO_RUN_CONTRACT", "expected": "ALLOW_STATIC_REGISTRATION", "actual": "ALLOW_STATIC_REGISTRATION", "run_performed": false, "reason": "Static contracts and refusal states remain inside the authorized no-run boundary."},
    {"trial_id": "MECH-GATE-TRIAL-002", "request": "START_WRF_CHEM_EXPERIMENT", "expected": "REJECT_EXECUTION", "actual": "REJECT_EXECUTION", "run_performed": false, "reason": "Release identity, component licences, data, compute and expert review are incomplete."}
  ],
  "decision": {"state": "REFERENCE_REVIEW_INCOMPLETE", "model_run_authorized": false, "tiny_synthetic_execution_authorized": false, "task1711_authorized": false, "reason": "The reference architecture is useful, but full source/runtime reproducibility, a final release identity, component licences, data, compute and expert ownership are not admitted.", "next_gate": "SEPARATE_FOUNDER_AUTHORIZATION_REQUIRED"},
  "boundaries": {"public_metadata_read": true, "repository_cloned": false, "archive_downloaded": false, "dataset_downloaded": false, "observation_acquired": false, "model_installed": false, "model_executed": false, "cloud_used": false, "api_key_used": false, "cost_aud": 0, "monitoring_active": false, "workos_data_used": false, "scientific_conclusion_formed": false, "local_conclusion_formed": false, "human_review_required": true}
}
